segment_id	text	annotator_1	annotator_2	annotator_3	agreed_rating
1135	"""Yes, old chap,"" I said, ""I'll do anything you jolly well like. I'm sick of doing nothing."" ""First rate!"" he answered. ""Then that's settled. I've all sorts of ideas and theories about the Holt Manor robbery and this affair of mine, and that telegram to-day, and other things that have happenedsome you know about, some you don't. I have a friend who was for twenty years at"	0		0	0
1136	But in his fresher days he had known the spell of the Uplift Club and the thrill of moving among the Emancipated; and he felt an odd sense of rejuvenation as he looked at the rows of faces packed about the embowered platform from which Howland Wade was presently to hand down the eternal verities.	3		0	
1137	"[pg 79] Tsumi fukaki Umi ni shidzumishi, Yūréï no ""Ukaman"" toté ya!
Funé ni sugaréru.


[pg 80] Ukaman to Funé we shitaëru Yuréï wa, Shidzumishi híto no Omoï naruran.
[The ghosts following after our ship in their efforts to rise again (or, ""to be saved"") might perhaps be the (last vengeful) thoughts of drowned men.44] Uraméshiki Sugata wa sugoki Yuréï no, Kaji we jama suru Funé no Tomomori."	3		4	
1138	His speech ended in a fit of breathlessness. He lay there, gasping. The doctor bent forward, looking at him first in perplexity and afterwards in amazement.	3		3	3
1139	We're terrible few for such a big place, but we maun make up for shortness o' numbers by extra mobility. The gemkeeper will keep the windy that looks on the verandy, and fell[Pg 264] any man that gets through.	0		0	0
1140	Tarzan leaped upon him—as Sabor springs to the kill, so sprang the ape-man. The momentum and weight of his body hurled the German to the ground, powerful fingers prevented an outcry and, though the officer struggled, he had no chance and a moment later lay dead beside the body of the dog.	3		5	
1141	She laughed and said it was foolish for the women to call her the Sago Lily. She had no coquetry; she spoke as she would have spoken of the stones at her feet; she did not know that she was beautiful.	1		1	1
1142	But all the while I was wondering about the Virginian: eating with him, sleeping with him (only not so sound as he did), and riding beside him often for many hours.	3		3	3
1143	As the car drew up in front of the Carwell mansion, from the bell of which fluttered a dismal length of crepe, a man stepped from the shadow of the gate posts and held out a paper to Harry Bartlett.	4		5	
1144	"""‘Don't look so vexed, stranger,' went on my tormentor, ‘perhaps there is some shine in the old girl yet; anyway you are a downright good fellow, you are, therefore you will, I guess, have a real A1 opportunity of working on the feelings of Fortune."	0		1	
1145	"Zambrano Row. He entered a large room and at the corner saw a stairway.
He knew this place. He had been here in the siege of San Antonio by the
Texans, and now he had the advantage over his guards, who were probably strangers."	3		4	
1146	Say you start with ten hens.  Each hatches out thirteen aigs, of which allow a loss of say six for childish accidents.  At the end of the year you has eighty chickens.	2	2		2
1147	Rustling is stealing cattle, and I once heard a well-known rancher say that all rich cattlemen had done a little stealing Your father drifted out here, and, like a good many others, he succeeded.	2	3		
1148	"So endeth this adventure of Sir Lamorack. And now it shall be told how it befel with Sir Tristram after Sir Lamorack had left Tintagel as aforetold.
Tail Piece Chapter Header"	0	1		
1149	He took his place at the head of the table and, filling his glass, bowed towards Hamel. Once more Gerald and his sister relapsed almost automatically into an indifferent and cultivated silence.	3	3		3
1150	He who, when torrid Summer's sickly glare Beat down upon the city's parched walls, Sat him within a room scarce 8 by 9, And, with tongue hanging out and	3	2		
1151	"Da Souza hesitated. ""Oom Sam,"" he said, ""my half-brother, keeps an eye on him. Sometimes he gets restless, he talks, but what matter? He has no money. Soon he must die. He is getting an old man!"" ""I shall send for him,"" Trent said slowly. ""He shall have his share!"""	0	3		
1152	"Isbister stopped abruptly. ""No?"" was all he said, but his bearing conveyed his helpful impulse. ""It may sound incredible,"" said the stranger, turning weary eyes to Isbister's face and emphasizing his words with a languid hand, ""but I have had no sleep—no sleep at all for six nights."""	2		1	
1153	Tell me my fears are wrong! Assure me I have not lost you—no, no, I won't even ask you. 'Tis not possible. I won't believe it of you—that you could be inconstant!	0		0	0
1154	Good it was to lay aside pick and spade and take sword Helmbiter again, and don mail and helm; and I made Harek fence with me, lest I should have lost my sword craft through use of the weapons whereby the churl conquers mother earth. But once the good sword was in my hand I forgot all but the warrior's trade.	3		3	3
1155	"I remembered my inability to fix my mind that morning, scarcely a month gone by, and how I had broken off to get my Daily Chronicle from the newsboy. I remembered how I went down to the garden gate as he came along, and how I had listened to his odd story of ""Men from Mars."""	3		3	3
1156	We were to hunt seals, and fish, and pry bivalves from the rocks at low tide, and build fires, and talk, and alternate between suspicion and security, between the danger of sedition and the insanity of men without defined purpose, world without end forever.	3		4	
1157	It wasn't easy to find open ground for a gallop, for there were endless small patches of cultivation and the gardens of country houses. We kept on the high land above the sea, and when we reached a bit of downland came on squads of Turkish soldiers digging trenches. Whenever we let the horses go we had to pull up sharp for a digging party or a stretch of barbed wire. Coils of the beastly thing were lying loose everywhere, and	5		5	5
1158	"And which way did they go this time?"" ""Noh, noh! First it wass two, and when they had gone then it wass three more."" ""I see. And two black crows—what might they mean now?"""	1		1	1
1159	Half of them had passed, or would on the morrow, yet vivid in my memory, obliterating every event that had come before or after, there remained the last scene before the gust of smoke blinded my eyes and the narrow slit that had given me sight of the interior of her cell closed between me and the Princess of Helium for a long Martian year. As if it were yesterday, I still saw the beautiful face of Phaidor, daughter of	3		3	3
1160	"But he found it stiff and perplexing. His motor-bicycle and Grubb's experiments and the ""mechanical drawing"" he had done in standard seven all helped him out; and, moreover, the maker of these drawings, whoever he was, had been anxious to make his intentions plain. Bert copied sketches, he made notes, he made a quite tolerable and intelligent copy of the essential drawings and sketches of the others. Then he fell into a meditation upon them."	3		2	
1161	Another was just behind it, and behind that yet another, and another, like great patient beasts rising from the coolness of a stream to follow a leader through the narrowness, of pasture bars. And in the booms, up the river, as far as the eye could see, were other logs awaiting their turn. And beyond them the forest trees, straight and tall and green, dreaming of the time when they should follow their brothers to the ships and go out into the world.	4		5	
1162	Our first idea had been to run due east till we struck the coast of	2		0	
1163	Folsom, the boss rustler, roared like a mad steer. He was wild to kill Jack. He begged for a gun to shoot out Jack's eyes. An' so were the other rustlers burnin' to kill him.	0		0	0
1164	CHAPTER XIV That woodman friend of mine proved so engaging it was difficult to get away, and thus when, dusk upon us, and my object still a long distance off, he asked me to spend the night at his hut, I gladly assented.	2		2	2
1165	As they passed the bend in the lane my brother saw the face of the dying man in the ditch under the privet, deadly white and drawn, and shining with perspiration.	4		4	4
1166	"""I'm going round your way and I'll see your friend home."" As Mr. Stanton professed himself ready for bed, the little party by the stove broke up. Lincoln fetched from a corner a dilapidated carpet-bag full of papers, and an old green umbrella, handle-less, tied with string about the middle, and having his name sewn inside in straggling letters cut out of white muslin. He and Stanton went out-of-doors into the raw autumn night."	5		4	
1167	Daylight was still lingering when Roy got up and went out on the porch. His keen ears had heard something. Helen fancied she herself had heard rapid hoof-beats.	3		1	
1168	She broke off with a little hysterical gasp, so that Mrs.	0		1	
1169	"What you loved, Madam, was only what you had lost, was only what you saw in this country—was only what this country means! Your past life, of course, I do not know."" ""Sometime,"" she murmured, ""I will tell you."" ""Whatever it was, Madam, you have been a brilliant woman, a power in affairs. Yes, and an enigma, and to none more than to yourself. You show that now. You only loved what Elisabeth loved."	0		1	
1170	As the little widow narrated her dream to one of the Misses Lester, the latter understood it to be something like the following: Mag saw a vast land with wooded hills and dales, green fields, lakes and rivers.	4		3	
1171	"""That may be lucky for you,"" he said, ""because the old witch-doctor, Zikali, has told him that he must not kill any English. What is your name? Mine is Thomas Halstead. I am interpreter here."" ""Allan Quatermain. Tell Zikali, whoever he may be, that if he sticks to his advice I will give him a good present."" ""What are you talking about?"" asked Dingaan suspiciously. ""He says he is English, no Boer, O king; that he was born across the"	0		1	
1172	The four gates themselves were set one at the inner, one at the outer side of each of these walls, and a hidden machinery so connected them, that of each set one could not open till the other was closed; and as for forcing them without war engines, one might as foolishly try to push down the royal pyramid with the bare hand.	2		3	
1173	"Lady Garvington frowned. ""What horrid things you say."" ""I only repeat what every one is saying."" ""Well, I'm sure I don't care,"" cried Lady Garvington recklessly, and rose to depart on some vague errand. ""I'm only in the world to look after dinners and breakfasts. Clara Greeby's a cat making all this fuss about—"" ""Hush! There she is."""	1		1	1
1174	The two Englishmen walked slowly back to the hut. Between them there had sprung up from the first moment a strong and mutual antipathy. The blunt savagery of Trent, his apparently heartless treatment of his weaker partner, and his avowed unscrupulousness, offended the newcomer much in the same manner as in many ways he himself was obnoxious to Trent.	3		1	
1175	Here were the great males towering in all the majesty of their imposing height; here were the gleaming white tusks protruding from their massive lower	2		2	2
1176	The hard work had all been done, and the two animals were resting, thoroughly exhausted, by the time Toad appeared on the scene, fresh and gay, remarking what a pleasant easy life it was they were all leading now, after the cares and worries and fatigues of housekeeping at home.	1		3	
1177	Then the milkman came swinging up the steps without his can and hurried off clattering down the road. Two or three minutes more elapsed, and then Rupert came bounding up also, his face pale but yet laughing; a not uncommon contradiction in him, denoting excitement.	3		2	
1178	"Lake George we shall surely find work for men to do. Rangers of wood and forest care nothing for winter ice and snow. We will go northward and eastward, asking news of Rogers and his Rangers. It may be that we shall fall in with them, and that we can make common cause with them against the common foe."""	0		3	
1179	He was just about to replace the board when it slipped from his hand and turned over, and he saw something written on the underside of it.	3		2	
1180	"Crash!
Flung from the seat, he sprawled through treetops, caught himself, fell to a lower limb, slid off and landed among thick bushes; and through these came to earth."	3		3	3
1181	"That afternoon in Prescott they purchased an outfit for Patches, and the following day set out for the long return drive to the ranch.
They had reached the top of the hill at the western end of the meadow lane, when they saw a young woman, on a black horse, riding away from the gate that opens from the lane into the Pot-Hook-S meadow pasture, toward the ranch buildings on the farther side of the field."	4		4	4
1182	God had made her soul a fair room; but his love had filled it with light, decked it with flowers and such artful furniture. He, in fact, as she very well knew, had given her the grace to deal queenly with herself.	3	3		3
1183	"And ... I'm hungry."" I stared at him. I had not suspected this aspect of the matter before. But it came to me at once—a positive craving. ""Yes,"" I said with emphasis."	0	2		
1184	"Lucien, and the people at the garage testify that he took out the car and returned it as stated."" ""No one has come forward who actually saw him waiting outside the club?"""	3	4		
1185	"He had pushed by the man standing there, had come in and—he had heard. ""Nance!"" he cried. ""I don't believe a word of it.""  He turned in his quick way to the men."	2	2		2
1186	"Prickly, all right."" ""My name is Gwig,"" said the Sorcerer, turning his heartless, cruel eyes upon his rival. ""Let me see you equal the sorcery I am about to perform."""	2	2		2
1187	"Mr. Jacks listened to his companion's words with unchanged face. ""If it isn't troubling you,"" he said, ""it would be of some interest to me.""


Mr. Coulson rose to his feet. ""You sit right here,"" he declared. ""I'll be back in less than five minutes."""		2	0	
1188	"""It's cold, too,"" murmured Joe, for as the afternoon sun slowly set the bleak winter day hastened forward in all its penetrating bitterness. ""What time is it, anyway?"""		4	2	
1189	His hopefulness was unbounded. His energy he tempered with all the tact and discretion his knowledge of men, and his experience in handling them, had taught him.		3	0	
1190	He could not be dislodged. This was not a bucking mustang, but a fierce, powerful, fighting stallion. No doubt, thought Bostil, this fight took place every time the rider mounted his horse.		3	2	
1191	"But at that he was the same haughty, immovable man as ever, and I remembered that each of us must live his own life; and so 'tis settled."" ""Well,"" said I, with a little of envy at his prospect, and much of sorrow at losing him, and some wonder about another matter, ""I'm glad for your sake, though you may imagine how I'll miss you."	0	3		
1192	There succeeds a short, intense silence; then there comes a sound. It is the rattle of the latch, being slowly lifted. At that, I am filled with desperation.		3	2	
1193	And when it had passed they closed behind it, staring up at us once more. The Dweller paused beneath us. Out of the drifting ruck swam the body of Throckmartin!		2	0	
1194	"Nevertheless, I will go to him. I have known men tell more truth in that state than in any other."" The servitor directed me to the library, and after desolate wanderings up crumbling steps and down mouldering corridors, sunny and lovely in decay, I came to the immense lumber-shed of knowledge they had told me of, a city of dead books, a place of dusty cathedral aisles stored with forgotten learning."	4	4		4
1195	"""Why, David!"" he said sorrowfully. ""I thought that you would be pleased with what I had done.  We planned these things together, and I am sure that it was you who suggested practically all of it. I have done only what I thought you wished done and I have done it the best that I know how."" I laid my hand on the old man's shoulder. ""Bless your heart, Perry!"" I cried. ""You've accomplished miracles."	3	2		
1196	Mediterranean. We met the country people going their ways to town; they looked at us with friendly patronage, knowing all about us, what we had come to see, and the foolishness of it, and especially the ridiculous cost of carozza that take people to Pompeii.	3	2		
1197	He had a niche apart in its temples.	0	1		
1198	Xodar and the green Jeddak were formally presented to each other. Then Thuvia was lifted to the least fractious thoat, Xodar and Carthoris mounted two others, and we set out at a rapid pace toward the east.	3	2		
1199	Therefore, none of the posse would have a point-blank shot at him. For those in the rear and on the sides the weaving course of the gelding, running like a deer and swerving agilely among the rocks, as if to make up for his first blunder, offered the most difficult of all targets.	2	3		
1200	They answered only with ineffectual shots. Thence the battle circled back over Niagara, and then suddenly the Germans, as if at a preconcerted signal, broke and dispersed, going east, west, north, and south, in open and confused flight. The Asiatics, as they realised this, rose to fly above them and after them. Only one little knot of four Germans and perhaps a dozen Asiatics remained fighting about the Hohenzollern and the Prince as he circled in a last attempt to save Niagara.	3	3		3
1201	"There was an exodus from Seven Mile the second day after the fire.
Keller went up Bear Creek, Phyllis accepted the invitation of Bess to stay with her at the Fiddleback, and her brother returned to the round-up."	0	2		
1202	"""I cannot say anything definite, for I do not know anything definite."" ""I would ask you one more question, Miss Stapleton. If you meant no more than this when you first spoke to me, why should you not wish your brother to overhear what you said?"	0	2		
1203	"Sydney Barnes did not answer, but his cheeks were like chalk. His mouth was a little open, disclosing his yellow teeth. He stared at the Colonel with frightened, fascinated eyes. ""I can see,"" the Colonel continued, ""that you remember. Young man,"" he added, with a curious alteration in his tone, ""be wiser than your brother! Give me the packet."" ""You killed him,"" the young man gasped. ""It was you who killed Morris."""	3	4		
1204	"He shook his head. ""Dead sea fruit,"" he answered. ""Fairy gold, fading in the clutch, worthless through and through. No, if my work has any merit, it's all for Socialism, now and ever!"""	1	3		
1205	"Pete was repaid a thousand-fold for his efforts by the old man's occasional: ""Couldn't 'a' done it any better myself, pardner."" For Annersley seldom called the boy ""Pete"" now, realizing that ""pardner"" meant so much more to him."	0	3		
1206	A light which, as they knew too well, was not visible from the harbour, and which might be shewing its fatal signal unguessed the whole night through, unless as now, by favour of the saints, and doubtless by the quick eyes of some fisherman of the neighbouring village, who had chanced to be far enough out to sea at the time, it were perceived before darkness should fall.	4	4		4
1207	Ten minutes later I stood before Dingaan, who greeted me kindly enough, and began to ask a number of questions about the Boers, especially if they were not people who had rebelled against their own king and run away from him.	1	2		
1208	"A moment they listened intently. Up to them, from very far, rose a wailing cry, tremulous, long-drawn, formidable. ""Oh! Then there are people, after all?"" faltered the girl, grasping"	1	3		
1209	I've got a notion tucked in the back of my head that you're watching me like a hen does her one chick, for their sake and not for mine. Right guess, I'll bet a dollar.	0	2		
1210	Doc, he done some things that seemed to us right strange at first.  He gets Pinto up in one corner and takes him by the ear, and tries to break his neck, with his foot in the middle of his back.  Then he goes around on the other side and does the same thing.  He hammers him up one side and down the other, and works him and wiggles him till us cow punchers thought he was goin' to scatter him around worse than		4	2	
1211	But the gently sloping Maryland fields were abloom with daisies.  A farmer's lad could be hired for a dollar to dig up the daisies and to bring a wagon load of dirt to the boat.	4	3		
1212	"""By all means, come.  It will be a comfort to me to know that I have one ally in the hall, however inefficient and ignorant of the subject he may be. I fancy there will be a large audience, for Waldron, though an absolute charlatan, has a considerable popular following."	2	2		2
1213	He kept flitting up and down, with his thin voice going talking, talking about his wretched self, and never a word of clear, firm statement from first to last.	0	1		
1214	Instinctively Miki had hated this foxhunter from the edge of the	1	0		
1215	"Christmas.
DEAR PANSY IRENE: I see Auntie's fine Italian hand in this! You wait till your father gets home, I'll learn you to sass back! Tell Mrs. Lancaster that it's an imitation and came in a box of lemon drops, and put it on this instant! The more you wear the better, this cold weather! I've got the bulliest terrier ever, from George. Show him to you next week.                      PETER. Frowning thoughtfully, her eyes still on the scribbled half-sheet,"	2	3		
1216	"Spike, flashed two rows of brilliant teeth and halted his barrow beside the curb. ""How goes it, Tony?"" questioned Spike, whereat the young Italian smiled, and thereafter sighed and shook his head."	3	3		3
1217	And the five oceans sprang upon Tintaggon and passed above his head. One by one the grip of the oceans loosened, one by one they fell back into the deep and still Tintaggon stood, and on that morning the might of all five oceans lay dead at Tintaggon's feet.	3	2		
1218	Guy gave no heed to the ground once he knew the general directions. He ran ahead (toward Y), so did Sam, but Guy glanced back to Yan on the trail to make sure of the line.	3	2		
1219	The case for reticence and discretion was a strong one. The night was dark; the rain-lashed street deserted; the man an utterly casual stranger—why, she hadn't even had a straight look into his face. His motive in getting off the car was at least dubitable. Even if not sinister, it could easily be unpleasantly gallant. A man might not contemplate doing her bodily harm, and still be capable of trying to collect some sort of sentimental reward for the ducking he had submitted himself to.	4	4		4
1220	"A voice was droning: ""Turn the lady, turn!  Turn the lady, turn!  Alamon left.  All swing; turn the lady, turn!"" ""Hello, Jim,"" called Gale, dragging Thorne round the corner of lava."	3	3		3
1221	So did I then feel, the Canitaur guards being able to slay me on the slightest whim of fancy that struck their minds into a sadistic mood. Yet I was not afraid, instead I was overcome by a feeling of relaxation, where all cares and worries are given up as frivolous burdens, not necessary and not helpful, being, in fact, harmful to the mind.	1	4		
1222	The moment held Shefford mute till sight of Fay Larkin's tear-wet face broke the spell. He leaped forward and his strong hands reached for the woman and the man.	3	3		3
1223	Thereafter, the trail outfit fed the cattle between the quartette, who sat their horses in speechless intensity, as the column filed through at random.	3	3		3
1224	The tale was told once again, other Rangers crowding round to hear. Pringle was naturally the spokesman, and Fritz, singling out from the group a man whom he had known before, asked him who the gallant-looking stranger was who seemed like the leader of a band.	3	3		3
1225	"The Impregnable City. Chapter 2:
The Defences Of Quebec. Chapter 3:
Mariners Of The Deep. Chapter 4:
Hostilities. Book 6:
Without Quebec. Chapter 1:
In Sight Of His Goal. Chapter 2:
Days Of Waiting. Chapter 3:
A Daring Design. Chapter 4:
In The Hour Of Victory. Book 7:
English Victors. Chapter 1:
A Panic-Stricken City. Chapter 2:
Surrender. Chapter 3:
Friendly Foes. Chapter 4:
The Last. Book 1: Border Warfare."		0	1	
1226	"Pete that evening and talk with him, The Spider would have left El Paso the next day, as he had planned, instead of waiting until the following evening, against his own judgment and in direct opposition to that peculiar mental reaction called ""a hunch"" by those not familiar with the niceties of the English language, and called nothing really more expressive by those who are."	0	3		
1227	"The advance agent says it is a high-class performance and will appeal particularly to the rich city people up in the mountains. It's a sort of open-air affair, you know."""	2	2		2
1228	Berengère, with considering looks. 'Ho ho! And so he has!' cried Bertran. 'I assure your Grace he is no novice. Many he has claimed, and many have claimed him. Shall I number them?' 'I beg that you will not,' she said, stiffening herself. So	0	3		
1229	"Sir Walter found, however, that the detective did not undervalue himself.
He was not arrogant, but revealed decision and immense will power. From the first he imposed his personality, and made people forget the accidents of his physical constitution. He said very little during breakfast, but listened with attention to the conversation."	3	3		3
1230	Dinner time passed and supper time arrived, but the children did not.	0	1		
1231	"It was Norhala who broke the silence. ""Tcherak! Greeting—Cherkis!"" There was merciless mirth in the buglings of her voice. ""Lo, I did but knock so gently at your gates and you hastened to welcome me. Greetings—gross swine, spittle of the toads, fat slug beneath my sandals."""	2	4		
